<?xml version="1.0" encoding="UTF-8"?>
<!DOCTYPE iterators SYSTEM "iterators.dtd">

<iterators>

  <iterator>
		<iteratorType>int</iteratorType>
        <keyWord>iterator</keyWord>
        <element>
			<elemType>int</elemType>
			<varName>x</varName>
		</element>
   </iterator>
   
   <iterator>
		<iteratorType>int</iteratorType>
        <keyWord>exists</keyWord>
        <element>
			<elemType>int</elemType>
			<varName>y</varName>
		</element>
		<arg>
			<argType>boolean</argType>
			<varName>z</varName>
		</arg>
   </iterator>
    
</iterators>

